,uuid,user_id,docid,model,nonfactual_spans,evidence,error_type,summary,dialogue
16,3cc5013c-4080-413e-aa5f-aec0dc93e349,sanjana,13681870,gpt4-32k-0613,,,,"Miley expresses her fatigue and lack of desire to go to work the next day, stating she needs some rest. Aaron echoes her sentiments, wishing for a holiday. He encourages her to keep going.","Miley: don''t want to go to work tomorrow!
Miley: wanna sleep!!!
Miley: need some rest :(
Aaron: know what u feelin
Aaron: really want some holiday already
Miley: :(
Aaron: fighting girl!"
27,c094b128-08b6-4187-91cf-c44d9ab25baa,sanjana,13681871,gpt4-32k-0613,,,,"Andy informs Sue that he will be working late until 4 and will arrive by 8, to which Sue responds with understanding and no issue.","Andy: Working late til 4 xx
Sue: no worries xx
Andy: be there by 8 xx
Sue: No probs babes xx"
32,149452c6-bf79-47b0-b0ee-ecfcf99caa7f,sanjana,13681429,gpt4-32k-0613,,,,"Cass confirmed with Jordan that he received his birthday card and money, which included £20. Jordan showed gratitude and apologized for not reaching out sooner. Cass selected a Thomas the Tank engine themed-card for Jordan because she believed he still liked it. Jordan confirmed his love for the character but requested a football-themed card next time since he''s 11. Both ended the conversation with expressions of love.","Cass: Hi darling, did you get your birthday card and money on time?
Jordan: hello Nanna! Thanks for the £20. Sorry I didn''t ring you before.
Cass: you still like Thomas the Tank engine don''t you? I picked it specially.
Jordan: Yes, Nanna. I will always love him! Next time, get me a football one or something. I mean, I''m 11 now!
Cass: I know, you are so grown up. Love you xxxxx
Jordan: Love you, Nan xx"
34,a8c98d99-c964-46d0-a51c-bca6569900c1,sanjana,13681439,gpt4-32k-0613,,,,"Phoebe can''t go out because her mother is angry with her for using and breaking her expensive perfume. The incident resulted in their whole house smelling strongly of the perfume, which Phil finds amusing but Phoebe doesn''t.","Phil: can you go out today?
Phoebe: no
Phoebe: my mum is still angry
Phil: why?
Phoebe: i used her perfume
Phil: so what?
Phoebe: i used it and broke it
Phil: really?
Phil: xd lol
Phoebe: not funny
Phoebe: it was very expensive
Phoebe: besides, our whole house stinks
Phil: so it was not so beautiful perfume?
Phoebe: it was, but not 100 ml for 80 square meters"
36,48d59334-9492-4cc1-a5ce-1b0378e34a1f,sanjana,13681441,gpt4-32k-0613,,,,"Joanna shares with Merve that their mutual acquaintance Lewandowska has been hospitalized due to measles. As a result, all those who have been in contact with her are urged to get vaccinated. Merve hasn''t seen her recently, but Joanna has since Lewandowska is her thesis mentor. Joanna plans to get vaccinated before work on the 18th, despite her busy schedule. Vaccinations are being organized in the main building from the 17th to the 19th.","Joanna: They are sending emails about Lewandowska.
Merve: What happened?
Joanna: <file_photo> 
Merve: Wooow!
Joanna: She is hospitalized because she has measles.
Merve: She had what?
Joanna: Anyone who had contact with her within the last couple of days must get vaccinated.
Merve: Luckily I didn''t see her since the last semester...
Joanna: I did, she is my thesis mentor :(
Merve: What will you do?
Joanna: They are organizing vaccinations in the main building from 17th until 19th.
Merve: You have to go!
Joanna: I know... And I just started working so I really don''t have a lot of time.
Merve: Come on, this is really important.
Joanna: I will try to do it before work on 18th, hopefully I won''t lose the entire day..."
37,3db1d56f-7cb9-4b23-9c8c-3e1f401d42cd,sanjana,13681482,gpt4-32k-0613,Filip wasn't around,"Derek : McCarthy: Filip - are you around? Would you have an Android cable I could borrow for an hour? I'm almost out of charge and I have a power pack  but forgot my cable
Tommy: : I am in Poland but can ring my wife and she will give you one",Intrinsic_Error,"Derek McCarthy asked if he could borrow an Android cable from Filip, as he had forgotten his and his phone was almost out of charge. However, Filip wasn''t around, but his friend Tommy offered to help. Tommy, who was in Poland, offered to ask his wife, Paulina, to provide a cable. He informed Derek that although she was at work, she would be home around 8:15 pm. Derek thanked Tommy for his help and agreed to the plan.","Derek McCarthy: Filip - are you around? Would you have an Android cable I could borrow for an hour? I''m almost out of charge and I have a power pack  but forgot my cable
Tommy: I am in Poland but can ring my wife and she will give you one
Tommy: Do you want me to?
Tommy: 67 glenoaks close
Derek McCarthy: That would be great if you could!! Otherwise I''m sitting here in the dark for an hour <emoticon_smile>
Tommy: Put it in gps and start driving
Derek McCarthy: <emoticon_thumbup>
Tommy: She might be at work for next 15 min but will help you for sure
Derek McCarthy: Thanks a lot mate
Tommy: Sent her msg. She will give it to you. Approx time when she will be at home is 8:15 pm
Derek McCarthy: Thanks again!! What''s your wife''s name  again??
Tommy: Paulina"
38,45c5ceec-5e80-46c0-acd5-e7e8a5209d9e,sanjana,13681509,gpt4-32k-0613,,,,"Abigail reminds Damien that it''s Sunday, which means they are going to church. She tells him to wear a coat and tie out of respect for God and others. Damien, while apprehensive, jokingly remarks about Sundays being only once a week. Abigail asks Damien to be ready on time.","Abigail: It''s Sundaay.
Damien: So?..
Abigail: You know what that means.
Damien: Hmm no I don''t x)
Abigail: Sunday means we go to church~.
Damien: Oh, yeah..
Abigail: Don''t forget to put on a coat and tie.
Damien: A coat and tie?.. Why?
Abigail: To show respect to God and others.
Damien: Omg..I''m glad Sunday is only once a week.
Abigail: I hope God didn''t hear that.
Damien: He''ll forgive me 
Abigail: Just be ready on time please."
39,56d9e1bc-3cd8-4074-a9b2-4aad1679fb6e,sanjana,13681516,gpt4-32k-0613,,,,"Frank and Zoe are expressing their love and well wishes for each other, likely at the start of the day. Zoe also sends Frank a video file.","Zoe: <file_video>
Frank: Love you!
Zoe: :-*
Frank: Have a good day, babe :-*"
40,0cb3ad47-eccd-4ae8-b635-ade086b44598,sanjana,13681560,gpt4-32k-0613,,,,"Hayden is facing a dilemma about his future, primarily driven by his fear of not earning enough money. He is interested in African Studies, but is considering becoming a flight attendant due to his language and swimming skills. However, he is apprehensive about the risk of flight accidents. Margaret reassures him and highlights the travel opportunities the job would provide.","Hayden: Anyway I have 1 month to write my thesis. And then I need to decide what studies I should choose and I have a problem because I don''t know what I can do in the future to make good money
Margaret: You''ll find something
Hayden: And the only studies I''m interested in are African studies but I''m not sure I can make big money later on haha except for working in the embassy or something like that. I was thinking about working as a flight attendant. It would be easy for me to get that job since I can swim (and here it''s obligatory) I''m even a water rescuer. I know English italian and polish and a bit of german.
Margaret: So go ahead for it
Hayden: But to be honest , I don''t think so that job is so great. I can''t work there forever and I''m not that sure I wanna risk every time hahah since flight accidents happen
Margaret: Hahahaha you shouldn''t think about that
Hayden: But I don''t wanna die hhahahahah
Margaret: It would be good you would get to travel a lot"
41,6ad7267d-d27a-4600-9b3d-93f6f9037020,sanjana,13681886,gpt4-32k-0613,She is concerned about possibly spreading the disease to her students,"Stella: : I wanted to come and visit you but I didn't want to get infected by the disease that you've been carrying
Stella: : You know... I'm a teacher, I could spread the disease",Intrinsic_Error,"Stella, a teacher, reaches out to her friend Sandra, who has been ill. She is concerned about possibly spreading the disease to her students. Sandra has started to feel better thanks to some effective medication. Stella offers to take Sandra to the cinema once she fully recovers, wanting to cheer her up. Sandra expresses her desire to watch an action movie, something contrasting her current, bedridden situation. They end their conversation optimistically, promising to reconnect soon.","Stella: Hi Sandra
Stella: Did you recover finally?
Stella: I wanted to come and visit you but I didn''t want to get infected by the disease that you''ve been carrying
Stella: You know... I''m a teacher, I could spread the disease
Sandra: Hello my dear
Sandra: I''m getting better every day but there''s still something left
Sandra: I have some effective medicines now
Sandra: All the drugs that doctors have been prescribing to me so far were useless
Sandra: Now the difference in my well-being is surprisingly considerable
Stella: It''s very nice to here that, I''m so happy for you!
Stella: Hope you''ll be in a perfect health soon
Stella: I want to take you to the cinema
Stella: They have a brilliant repertoire now
Sandra: Oh, I dream of getting out of the house!
Sandra: I used to love laying in the bed for hours, but now I hate it
Stella: I understand
Stella: Just tell me, what kind of movie would you like to watch?
Stella: A romantic comedy, horror, fantasy or something else?
Stella: I''ll do some research in my friends'' midst and try to choose the best option :)
Sandra: I''m dreaming of watching some action movie
Sandra: With all the special effects and dynamic action
Sandra: Something that would be the opposite of my current situation :)
Stella: You got it! :)
Stella: I''ll find something special for you
Stella: So I''m keeping my fingers crossed for your quick recovery
Stella: Talk to you soon! :)
Sandra: Thanks, Stella, my darling. You made my day :)
Sandra: Bye bye"
42,9ae77f56-8e7b-4e91-b5e5-a33e8e5bde40,sanjana,13682217,gpt4-32k-0613, programming language she's been learning for a month,Agata: : Sorry. After just one month of coding I would be like plain English to you :P,Intrinsic_Error,"Guido reaches out to Agata because he doesn''t understand her Facebook posts, which come from her Twitter and are often about JavaScript, a programming language she''s been learning for a month. Although Guido confuses it with Java and compares it to understanding Chinese, he recognizes Agata''s enjoyment in her new interest. Agata''s husband doesn''t mind her new job and there''s a joke about her speaking ""JavaScript"" to him.","Guido: Hi, Agata, are you OK?
Agata: Hi, Guido. Sure, I''m OK :) And you?
Guido: I just have trouble understanding your posts on Facebook. 
Agata: Really?
Guido: Maybe it''s because I don''t know anything about Java? :(
Agata: Thanks for the concern :) All my Twitter posts go to my Facebook account. I think I might change that! 
Guido: Don''t worry :)
Agata: By the way, it''s JavaScript, not Java. Except for the name they really have not much in common :)
Guido: Sounds like Chinese to me :(
Agata: :)
Guido: It''s hard to understand the concept :(
Agata: Sorry. After just one month of coding I would be like plain English to you :P
Guido: I can see that you enjoy it.
Agata: I really do. Finally I found something interesting for me.
Guido: And what about you husband? 
Agata: What about him?
Guido: Doesn''t he complain about your new job?
Agata: Not at all! Why would he? 
Guido: So you don''t speak to him in Chinese language? I mean in JavaScript language, hahahha"
43,ea862550-ea15-4a04-8b7f-d5ac9460b542,sanjana,13681924,gpt4-32k-0613,,,,"Sophia apologizes to Mason, offering a hypothetical kiss as an apology if they were in person. Mason jokingly asks for a photo of this, to which Sophia agrees but wants to make herself look better before doing so. Mason insists that Sophia looks good all the time, regardless of make-up. Sophia, laughing, then sends a photo as requested.","Sophia: I''m sorry
Mason: It''s fine
Sophia: Ok...If u was there, I would give you a hot kiss for apologize
Mason: Hahaha. You still send me a photo one
Sophia: What photo?
Mason: Kiss photo. Haha
Sophia: Hehe I sent u already such a photo
Mason: Another one wouldn''t hurt
Sophia: Maybe later :) When I take a shower and look good
Mason: And who says you don''t look good now ?
Sophia: Me
Mason: Let me be the judge of that
Sophia: No
Mason: I''ll still love you the same. Whether you have make up or not
Sophia: Hehe but I don''t  want u to see me when I do not look good
Mason: You must
Sophia: I must what?
Mason: Send me the kiss now
Sophia: Haha
Mason: Doesn''t matter how you look, you''ll still look good to me
Sophia: Hahah
Sophia: <file_photo>"
44,cdd2434a-6ead-44b8-a5fb-0bef3c59f3d9,sanjana,13682118,gpt4-32k-0613,,,,Ben and Steven agreed to have pizza at Marco''s for dinner.,"Ben: pizza tonight?
Steven: sure thing!
Ben: at Marco''s?
Steven: (y)"
45,e8f387ac-0e05-4612-8e67-ad7d3a04e817,sanjana,13682134,gpt4-32k-0613,,,,"Javier asked Judie if she knows any tattoo parlors with English-speaking employees, and she suggested Warsaw ink. Although Judie hasn''t personally had a tattoo done there, her girlfriend has. After seeing a photo of the tattoo, Javier was impressed but surprised to hear it cost 1000. He decided it would be cheaper to get a tattoo back in Colombia.","Javier: Hey do you know any tattoo parlors over here with English speaking employees?
Judie: Oh there''s Warsaw ink
Javier: the name sounds neat... have you had a tattoo done there?
Judie: nope but my gf has
Javier: got a pic?
Judie: <file_photo>
Javier: wow that looks amazing
Javier: how much did she pay?
Judie: it was a 1000
Javier: fuck
Javier: let me just get a tatttoo back in colombia then, thx"
46,2961226a-4310-487e-9024-6546b06e6a1f,sanjana,13682269,gpt4-32k-0613,,,,"Sue has asked James to pick up the car after work tomorrow. James confirmed and inquired if he also needs to pay. Sue assured that she would transfer the money, to which James responded positively.","Sue: can you pick the car up after work tomorrow please
James: yes and pay?
Sue: yes I will transfer the money in 
James: ok x"
47,875dddc7-fcbc-402a-8544-89c1976b0937,sanjana,13682284,gpt4-32k-0613,,,,"Pete asks Adelle if she has cleaned the hamster cage, and upon her negative response, he reminds her that it is her turn. He insists that she should do it after school without any excuses, to which she begrudgingly agrees.","Pete: Did you clean the hamster cage?
Adelle: No. Is it my turn?
Pete: Yes. After school, no excuses.
Adelle: Fine."
48,0f5413eb-0c8d-4a2b-8bb8-496a4c12ac22,sanjana,13682408,gpt4-32k-0613,they decide through a card pack which animal they're drawn to,"Sophie: : you will have to tell me about the fox.. do you decide what your animal is or does someone tell you?
Jenkin: : There is a pack of cards and you choose the one that you are drawn to 
Sophie: : oh right I would choose the Fox
Jenkin: : well I didn't know but I was drawn to the dolphin
Sophie: : oh
Sophie: : oh
Sophie: : oh
Jenkin: : I will bring them over tomorrow",Intrinsic_Error,"Jenkin and Sophie discuss their respective spirit animals, with Sophie identifying with a fox and Jenkin, a dolphin. Jenkin mentions that he''s been reading about spirit animals and they decide through a card pack which animal they''re drawn to. He agrees to bring the cards to show Sophie the next day.","Jenkin: hey what is your spirit animal?
Sophie: what?
Jenkin: go on?
Sophie: I dont know a fox lol
Jenkin: are you wiley?
Sophie: sometimes
Jenkin: I am a dolphin
Sophie: I think you are a bit mad like the mad hatter
Jenkin: I have been reading about animal spirits its quite good
Sophie: you will have to tell me about the fox.. do you decide what your animal is or does someone tell you?
Jenkin: There is a pack of cards and you choose the one that you are drawn to 
Sophie: oh right I would choose the Fox
Jenkin: well I didn''t know but I was drawn to the dolphin
Sophie: oh
Jenkin: I will bring them over tomorrow
Sophie: oh yes please that will be great"
49,05fc8ddf-284f-4ab7-83fb-b3d9ee737320,sanjana,13682578,gpt4-32k-0613,,,,"Frank and Hope express their love for each other, playfully incorporating their own names into their affectionate responses.","Frank: Hey
Hope: Hi :)
Frank: I love you
Hope: I love you too <3
Frank: Well, I HOPE so!
Hope: FRANKly, I really do ;) <3"
50,1236ba3c-888d-4363-a118-be25179b16e7,sanjana,13715824,gpt4-32k-0613,,,,"Nancy, Phil, and Vic are discussing different social platforms where they can consume news, trends, and interact with others. Phil prefers Twitter for its fast delivery of news and updates. Vic prefers Facebook and Instagram for their interactive features and visual content. Nancy asks about Tumblr, but both Phil and Vic don''t use it. They suggest that they lack the time to maintain a blog. They all have different preferences for social media platforms based on their individual interests and time constraints.","Nancy: Yeah, but u can also read the news online ;)
Phil: I know, but imagine - ur keen on technology and u get all the news in one place. Then u can choose what to read and what not.
Nancy: Sounds sensible. Does it have something 4 fashion?
Phil: Probably so. Not sure, though.
Nancy: How about u, Vic?
Vic: I still prefer Facebook. Had Twitter once, but the interaction with others is nothing compared with Facebook.
Phil: Well, it''s intended in a completely different way. 
Vic: What do u mean?
Phil: IMO, Twitter is not for interacting like on Facebook, but for getting news fast and from reliable, more or less, sources. U can follow anyone and anyone can follow u.
Vic: Still, on Facebook I can share stuff with my friends, join groups and talk about things that interest me. And I don''t have to limit myself to 140 characters.
Phil: 280. Still, a downside. OTOH, if ppl were able to write as much as they wanted, Twitted would get as cluttered as Facebook.
Nancy: So no one uses 4 example Instagram?
Vic: I do. 
Phil: Not 4 me. I don''t post that many pictures online. 
Nancy: But u can follow ppl and see what they''re doing or offering. There are also companies on Instagram.
Phil: I know, but I''m more interested in news and gossip than seeing someone post a picture of their breakfast. 
Vic: That''s not all ppl post on Instagram!
Phil: So, what else?
Vic: Depends on ur interest. I, for one, like to observe all the fitness accounts :)
Phil: And does this motivate u to train?
Vic: No, but it gives me hints what to do and what not. 
Nancy: What do u think about Tumblr?
Phil: What?
Vic: Heard about it, but never had an account.
Nancy: It''s a microblogging website. U can post blog entries, pictures and basically everything u want there. And ppl can observe u!
Phil: Don''t have that much time to write a blog.
Vic: Me neither. 
Phil: Nancy, y do u ask these questions? ;)
Nancy: I have my reasons ;)"
51,51b6fcfc-09ee-4259-adc2-61763e84b773,sanjana,13715917,gpt4-32k-0613,,,,"Baron informs Gabriel and Gavin about a match scheduled for the following week. Gabriel suggests that their tutor should join them. Baron offers to sign on the calendar and provides a file link when Gavin asks for it. Gavin proposes to add more people from their group, which Gabriel agrees with.","Baron: What''s up.
Baron: there is a match next week.
Gabriel: Hey, our tutor wanted to join us
Baron: Sign on the calendar
Gavin: link please?
Baron: <file_other>
Gavin: let''s add people from our group
Gabriel: good idea"
52,58de0a99-3ab1-41df-9f47-e934c4958bb2,sanjana,13729256,gpt4-32k-0613,,,,"Harry is waiting for Ema outside for a movie that has already begun. Ema, who had previously told Harry she was ready, asks for an additional five minutes to get ready. Harry expresses frustration at Ema taking longer than expected.","Harry: Where are you? i am outside
Ema: coming just 2 mins...
Harry: You told me you were ready.. you know movie has already started
Ema: i am sorry give me 5 minss
Harry: Damn! take foreverrr"
53,622d14d0-bba0-44cf-8acf-00e1b328bdf0,sanjana,13716119,gpt4-32k-0613,,,,"Dan, Tim, Chris, and Martin are planning to go out on Saturday. Tim proposes to start at 8. However, Dan and Martin will have to go home early. Tom cannot join due to a party at his in-laws. Tim and Chris tease Dan and Martin for acting old. Chris jested that he and Tim might be the last two standing at the end of the night.","Dan: Guys, so are we going out on Sat?
Tim: I''m ready when you are
Chris: I''m OK too, in the centre right?
Tom: I''m out guys sorry. 
Dan: come on Tom, what''s wring this time
Tom: told ya before. party at in-laws
Chris: always the same story right
Martin: right guys, so what time?
Tim: start @8? finish. 8 if we''re lucky
Dan: yeah, i need to be home at 2 and ready to drive on Sunday noon
Chris: so you takin it easy this time
Martin: i guess i''d have to as well
Tim: guys you sound like 60 yos
Chris: Tim, are the last two standing or what?
Tim: i gather
Dan: you two will also grow up one day. "
54,3e7d1bf1-1308-4a0c-b9f3-9312973d3e0e,sanjana,13716129,gpt4-32k-0613,,,,"Sawyer proposed to have a ball game that night and asked if it could start at either 5:30 or 6. He mentioned that they have the pitch booked until 8. Sutter said he couldn''t participate because he''s injured. Wheeler asked if it could be at a later time but eventually declined due to the game''s early start time. Lastly, Yardley commented that maybe next time would work out better.","Sawyer: ball game 2nite?
Sutter: injured
Wheeler: what time?
Sawyer: 5.30? 6?
Wheeler: anytime l8r?
Sawyer: pitch booked at 8 so we need to start earlier
Wheeler: so im out sry
Yardley: i guess next time be better"
55,e56dfbf5-fbdc-432e-9e83-81c4f9ba81c4,sanjana,13716169,gpt4-32k-0613,,,,"Casey shared a photo of her nail art which she created using new nail polish. Both Amelia and Kristen admired it and asked Casey to do their nails too. However, Casey refused saying it was too time-consuming as it had taken her nearly four hours.","Casey: <file_photo>
Amelia: these are so nice!!! did you do them yourself?
Kristen: wooow amazing
Amelia: i want my nails done like that too!
Casey: yeah i did it myself :D got a new nail polish but damn it took me nearly 4 hours lol
Amelia: can you do it for us too?
Kristen: pretty please!
Casey: sorry you guys... it was a nightmare :( seriously 4 hours for nails is too much"
56,311d0e9f-e63e-4d31-ab89-2e4025456d80,sanjana,13716170,gpt4-32k-0613,,,,"Lorenna informs her friends that she won''t be able to attend a party as she needs to care for her sick daughter, Emma, who has a fever. Emma is currently sleeping and isn''t feeling too bad, but Lorenna plans to stay home with her for a few days. Her friends, Ann and Shirley, express their sympathy and send virtual kisses for Emma.","Lorenna: Girls, Im sorry, I cant come to the party tomorrow :(
Lorenna: Emma has a fever and I need to take her to the doctor.
Ann: Oh Im so sorry about her:(
Shirley: :( 
Shirley: how''s she feeling?
Lorenna: not too bad, but I need to stay at home with her for a few days.
Lorenna: she''s sleeping now. 
Ann: give her a kiss from auntie Anna! :*
Shirley: and from me too! :*
Lorenna: thanks! :*"
57,258ab7da-a41c-45ea-98a6-dbc148bd96a8,sanjana,13716404,gpt4-32k-0613,or long ago,Not found,,"The friends, Jess, Lynn, and Charlie, discuss dreams and their potential meanings after Jess shares a dream about being a lion tamer. While Jess initially jokes about the dream hinting at potential future events, such as visiting Africa, Lynn suggests dreams could reflect our subconscious. Additionally, Charlie shares the theory that even strangers in dreams are based on real people we''ve encountered. The friends conclude that it''s fascinating how the brain can store and recall people''s faces, even those seen briefly or long ago.","Jess: Guys, last night I dreamt I was a lion tamer, does it mean I should go to Africa this summer? XD
Lynn: Or maybe you''ll meet a handsome zookeeper? :D
Charlie: Or you''ll get attacked by a stray cat?
Lynn: You''ve just spoiled all the fun! :P
Jess: Knowing my luck, Charlie might be the closest to the truth.
Charlie: Do you really believe that dreams can mean something?
Jess: No, of course not! I was just joking. It was such a surreal dream that I had to share it with you ;)
Lynn: Well...
Jess: Do you believe in dreams, Lynn?
Lynn: I''m not saying I believe, but I think that sometimes it is possible that our dreams are telling us something. Not like they can show us our future or anything like that, it''s just that dreams reflect our subconsciousness, don''t you think?
Jess: I guess? 
Charlie: I''ve read somewhere that when we see strangers in our dreams, in fact we must have seen them somewhere before. Our brain is not able to create such images on its own, it must have registered some random people''s faces, and it uses them when we dream.
Jess: So you''re telling me the circus owner from my dream can really be some gentleman who lives in my neighbourhood?
Charlie: Exactly! You don''t even remember his face, but after you saw it just once, your brain keeps it somewhere in storage.
Lynn: WOW, it sounds really cool!"
