,uuid,user_id,docid,model,nonfactual_spans,evidence,error_type,summary,dialogue
87,84a2f2bb-c719-4982-9b28-e357a85c2af0,ann_epbi,13611884-1,gpt4-32k-0613,,,,"Nathan and Deborah are planning a family trip and decide to pack everything a day ahead. They''re considering the space required in the car for their daughters'' items, including boots and warm jackets. They plan to bring bicycles for some alone time while the rest of the family hikes. Nathan has a dentist appointment after work the next day and will pick up travel sickness syrup while Deborah picks up their daughters from school. They plan to leave for their trip after a quick meal at home.","Nathan: Hey Honey, what are our plans for tomorrow then?
Deborah: So I''ve been thinking that we should pack everything today, we won''t have time tomorrow
Nathan: Totally true, I started packing my stuff in the bedroom, I also told the girls to start packing too
Deborah: If Sofie wants to take the unicorn we won''t have much space in the car XD
Nathan: No, I explained to her that he''ll be fine without her these few days, I hope it worked :D
Deborah: We need to take boots and those warm jackets for the girls, my parents promised them to take them on a trip to the forest
Nathan: I remember, Lucy was really excited about that. Are we taking the bicycles?
Deborah: Yeah, don''t you think we could use some alone time while the rest of the family is hiking? XD
Nathan: Now you''re talking! We could have a ride to this beautiful cliff where we were last year!
Deborah: Why not, it''s a wonderful idea! :*
Nathan: So tomorrow I''m seeing the dentist after work, you go to pick up the girls from school
Deborah: Yeah, then we meet at home, have a quick bite (you probably won''t, haha!)
Nathan: Thanks Honey, so nice of you to remind me of this! After the quick bite you girls have, we are off!
Deborah: Damn, I forgot to buy this syrup for travel sickness. Will you have time today to do it?
Nathan: Yes, it''s feasible :) I''ll do it on my way from work
Deborah: Wonderful! So see you in the evening then?
Nathan: I should be home around 6, if nothing happens
Deborah: Dinner will be waiting for you in the oven, bye :*"
88,84fa7f33-9b96-4923-bca5-1f88717ff25a,ann_epbi,13680442,gpt4-32k-0613,,,,"Mika offers Linda some perennial plants for her garden to prevent them from being composted. Linda declines, explaining that she won''t be able to tend to the gardening before she departs. Mika expresses disappointment.","Mika: Dear  Linda, would you like a few plants For your garden? All perennials.It would be a shame to throw them onto the compost heap.
Linda: Hello Mika: A nice offer, thank you, but I won''t manage to do any gardening before leaving.
Mika: What a pity!"
89,ca0fd59b-680a-4861-bd5f-c27aa64f1bbc,ann_epbi,13680611,gpt4-32k-0613,,,,"Steve informs Gulab that the USA won their recent game, and shares that England will be playing against Croatia tomorrow at 2:00 PM. Gulab acknowledges the information but had forgotten to check the results for the USA''s game.","Steve: BTW, USA won last night!
Gulab: I forgot to check!
Steve: England playing tomorrow at 2:00!
Gulab: That''s right, Croatia?
Steve: Yep."
90,cd656015-6d2a-4bec-9f6f-b3a43f50b260,ann_epbi,13680757,gpt4-32k-0613,,,,"Greg informs Betsy he has to stay late at work and asks if she can pick up their child, Johnny, from kindergarten. Betsy is also working late and reminds Greg that Tuesdays are his responsibility. Greg says he will try to figure something out.","Greg: Hi, honey. I need to stay after hours :-(
Betsy: Again?
Greg: I''m sorry!
Betsy: What about Johnny?
Greg: Well, could you pick him up? 
Betsy: What if I can''t?
Greg: Betsy?
Betsy: What if I can''t?
Greg: Can''t you, really?
Betsy: I can''t. Today I need to work long hours as well. Tuesdays are your days in the kindergarten.
Greg: Talk to you later. I''ll see what I can do.
Betsy: You''d better think of something.
Greg: Oh. Just stop it now."
91,ed997c73-63a5-4ea8-8c1a-fede592d0fe7,ann_epbi,13680782,gpt4-32k-0613,,,,"Maya asks Boris to bring in the clothes hanging outside as they are likely dry and it might rain soon. Boris, who is not at home, promises to inform Brian to handle the task. Maya is thankful for his response.","Maya: Bring home the clothes that are hanging outside
Maya: All of them should be dry already and it looks like it''s going to rain
Boris:  I''m not home right now
Boris: I''ll tell Brian to take care of that
Maya: Fine, thanks"
92,bc05e0e4-40fd-44c3-92d0-d84ce5571b54,ann_epbi,13611442,gpt4-32k-0613,,,,"Helen reached out to Simon, let him know she had been trying to call him, and then requested him to bring some toilet paper as it had run out. Simon, who missed her call due to being on the phone, agreed to fetch the tissue paper, laughing off the awkward situation.","Helen: Hey, Simo, are you there?
Simon: Yep babe, what''s up?
Helen: I was calling you before...
Simon: Sorry I was on the phone, I didn''t hear you... Tell me.
Helen: It''s a bit embarrassing... The toilet paper is finished, could you fetch me some tissues, please?
Simon: Hahaha sure, no worries!"
93,24562d72-3af9-409c-af32-4d85ff0addf9,ann_epbi,13680874,gpt4-32k-0613,,,,"Tiffany asks Railey to buy her a burger on her way home, to which Railey agrees.","Tiffany: buy me a burger on your way home
Railey: ok
Tiffany: thx, sis :)"
94,943178cf-b22f-4c5b-9d99-41405938caa3,ann_epbi,13680992,gpt4-32k-0613,,,,"Mr. Williams asks Ms. Blair to join him for a coffee, and she happily agrees. After discussing preferences, they decide to meet at her favourite coffee place near the square in a side alley at 2 p.m.","Mr. Williams: Ms. Blair, would you like to go for a coffee?
Ms. Blair: I thought you''d never ask.
Mr. Williams: That''s outstanding. Do you have a favourite coffee place?
Ms. Blair: I actually do. It''s near the square in a side alley.
Mr. Williams: I think I know which one. Let''s say 2 p.m.?
Ms. Blair: Sounds great. See you there :)"
95,024a95c5-03f7-416e-af77-decee16f29fe,ann_epbi,13681079,gpt4-32k-0613,,,,"Dinny asks Terry to remove his dog before she arrives due to a slight fear of dogs, and Terry agrees.","Dinny: can you take your dog away before i come?
Terry: are you afraid?
Dinny: a little
Terry: ok than"
96,e82695b5-1dde-454e-a9ea-9c523a652ea1,ann_epbi,13680873,gpt4-32k-0613,,,,"Darcy asked Adam if he had ever been to Egypt due to his extensive travel history. The reason behind her question was that their mutual acquaintance, Aaron, has a connecting flight in Cairo and was contemplating leaving the airport to sightsee for a few hours. Adam advised that it could be a worthwhile visit, as long as Aaron is cautious.","Darcy: have you ever been to Egypt?
Adam: why would you think Ive been to Egypt?
Darcy: you travel a lot
Adam: if you say so, ive only been to a few countries. why do you ask?
Darcy: Aaron has a connecting flight in Cairo and might leave the airport for a few hours to pass the time.
Adam: I see. Should be worthwhile as long as hes careful.
Darcy: thats what im thinking"
97,f6764cd7-4cff-4e98-a416-d6c11d52ad28,ann_epbi,13680968,gpt4-32k-0613,Boris reminds her to initial the change,"Sarah: : Do I need to initial the change?
Boris: : Yes, please come see my assistant at your earliest convenience.",Intrinsic_Error,"Sarah''s request for PTO was denied due to many requests and her relatively low seniority. However, Boris offers her first choice of dates for the following week and promises to consider her if there are any cancellations. Sarah agrees to this compromise, planning for a long weekend the following week. Boris reminds her to initial the change with his assistant and thanks her for her understanding and flexibility.","Boris: Due to the number of PTO requests this week, we had to decide who will be allowed to take off based on seniority. 
Sarah: I understand.
Boris: Unfortunately, you are too low on the totem pole and we will have to deny your request.
Sarah: Oh, that''s too bad! Is there any compromise? I really wanted to have some time with my family.
Boris: I can give you first choice of dates the week after, but that''s the best I can do.
Sarah: What if someone cancels?
Boris: That is a rare, but yes, I will come to you first.
Sarah: Thank you.
Boris: Again, I''m very sorry.
Sarah: Could you amend my request for the following week, Monday through Wednesday?
Boris: Certainly. That should be no problem.
Sarah: That''s great, at least I''ll have a long weekend!
Boris: Very true. No problems from my side.
Sarah: Do I need to initial the change?
Boris: Yes, please come see my assistant at your earliest convenience.
Sarah: Certainly, no problem.
Boris: Thank you for being so flexible.
Sarah: Sure, I understand we can''t all be off. You are just trying to be fair.
Boris: That''s it exactly.
Sarah: Thank you again for explaining it so well.
Boris: My pleasure. Have a nice holiday and enjoy your time off.
Sarah: Thank you!"
98,c44eecf1-32ce-472a-8663-24426cdbe632,ann_epbi,13680972,gpt4-32k-0613,,,,"George has been trying to talk to Donna about a sensitive matter. Initially, they discuss meeting in a coffee shop to discuss it, which Donna questions due to the delicacy of the situation. George agrees, and then invites Donna to his place for the discussion instead.","George: Hi Donna. I''ve been trying to catch you.
Donna: What about?
George: A rather delicate matter.
Donna: Did you catch AIDS?
George: Very funny!
Donna: It is, isn''t it?
George: I don''t think so.
Donna: Too bad. So what do you want?
George: Could we meet and discuss it somewhere?
Donna: Like where?
George: Like in a coffee shop or somewhere.
Donna: You sure a coffee shop is better to discuss delicate matters.
George: Come to think of it, you are right. It''s not.
Donna: See? So what''s up?
George: Couldn''t you come to my place tonight?"
99,451c4329-6bbe-4dc5-9366-45dff0ee6f98,ann_epbi,13681165-1,gpt4-32k-0613,,,,"Alyssa and Derek discuss Fergie''s rendition of the national anthem, indicating they both found it lacking in quality. Derek humorously exaggerates his criticism, and they both find humor in Fergie''s confidence in her performance.","Alyssa: Have you seen Fergies national anthem? Illuminati does a great job.
Derek: This is not normal. I saw it last week
Alyssa: What do you think about it?
Derek: I can fart bright stripes and bright stars better then she sings.
Alyssa: The best part is that she acts like she nailed it. But at least it''s funny in a good way.
Derek: It is"
100,5f7e43c3-2088-44e7-aa37-1103caec1d33,ann_epbi,13681171,gpt4-32k-0613,,,,"Tanya checks on Rosie''s condition which has improved, but she''s still not fully recovered. Tanya expresses relief and concern.","Tanya: are you better today?
Rosie: better, but not good
Tanya: it''s great to hear that
Tanya: i was worried"
101,dcbc7546-7a40-4177-942a-b83243dc7ee6,sanjana,13727579,gpt4-32k-0613,agreeing to prepare some food,Mum: : I'll wrap something up for you.,Intrinsic_Error,"Steve expressed to his Mum that he was very hungry, to which she responded by agreeing to prepare some food for him. Steve thanked her and expressed gratitude for her help.","Mum: hungry?
Steve: starving...
Mum: I''ll wrap something up for you.
Steve: You''re the best, thank you!"
102,b7f644a7-3417-4ea7-ac3c-9fd5e2045be2,sanjana,13727716,gpt4-32k-0613,,,,"Aude and Susie discuss how Ted is doing, and Susie confirms that Ted kept his plasters on until that morning after his shower. They both joke about Ted''s appearance with them, and Susie relates it to a memory from Poland.","Aude: Hi Susie, how is Ted this morning? Did you find plasters?
Susie: yes. He kept them till this morning after his shower.
Aude: he must look sexy whith them... lol
Susie: a  memory from  Poland!"
103,b9c2cf5a-6905-45d4-986c-bcb00cecdc73,sanjana,13727809,gpt4-32k-0613,They plan to remind each other,"Thomas: : Remind me before 
Thomas: : Like the day before k?
Matt: : For sure ",Intrinsic_Error,"Matt reveals to Thomas that he has gotten a ticket to see Dawid Podsiadlo, expressing his excitement. Thomas is equally thrilled and plans to join Matt. They plan to remind each other the day before the concert. Thomas mentions he''s attending alone at the moment, though Maria might also be interested in going.","Matt: Hey
Matt: I got my ticket for Dawid Podsiadlo!!!
Matt: So stoked!
Thomas: Whooaa that''s great!!
Matt: I will see you there then! 
Thomas: Yes for sure
Thomas: Remind me before 
Thomas: Like the day before k? 
Matt: For sure 
Matt: Who you''re going with 
Thomas: by myself for now
Thomas: I meant until now haha
Matt: Right on 
Matt: I am so stoked tho
Thomas: Me too 
Matt: I might ask a few more people if they''re coming ;) 
Thomas: Maria was interested I think 
Thomas: But I am not too sure
Thomas: i will ask her"
104,98c7b5d4-797e-44c2-a0cf-75c725d0c89c,sanjana,13728397,gpt4-32k-0613,,,,Karine and Jessie are watching a video file that features them when they were in kindergarten.,"Karine: <file_video>
Jessie: That was us at kindergarten!
Karine: yes!!"
105,ae518e7e-39b0-47b9-b449-0dc2bd515d92,sanjana,13728535,gpt4-32k-0613,,,,"Laura asks Kas if they could tidy up her messy dreadlocks over the weekend. Kas responds that they might be able to, but they need to confirm with their work schedule first. They assure Laura that if they can, it would take a few days to sort out her dreads. Kas will let Laura know by that night.","Laura: Do you think you can tidy up my dreads for me this weekend?
Kas: Probably. Have to check my schedule with work first and let you know.
Laura: <file_photo>
Laura: <file_photo>
Laura: <file_photo>
Laura: They''re really messy.
Kas: It''ll take a couple of days to sort out the mess. I''ll let you know tonight if I can do it."
106,f0d70e64-1e18-4711-a251-c6dae3d55b8d,sanjana,13727853,gpt4-32k-0613,,,,"Jen is considering ending her relationship with a man who is abusive, exploitative, and refuses to pay her back the money he owes her. Her friend, Jane, supports her decision, pointing out that she had warned Jen from the beginning about this man. Jen admits she''s scared of the confrontation that will ensue when she asks him to leave, but Jane encourages her to cut her losses and move on. Jane reassures Jen that she can lean on her for support.","Jen: I think I''m through with the dickhead. He''s being a pain again. I''m going to tell him to move out.
Jane: Did he at least give you back the money he owes you?
Jen: No. He''s freeloading and said he has no intention of giving back my money because I don''t deserve it with the way I act.
Jane: He has a nerve doesn''t he? How dare he?!!!
Jen: I''ve learnt to hate him with a passion. He''s like vermin that you can''t cull.
Jen: Abusive, nasty, annoying, irresponsible. He disgusts me.
Jane: Get rid of him! I told you right from the beginning that he''s no good.
Jen: Yeah you were absolutely right.. as always.
Jane: I hate to say it but I can smell a fucktard a mile away.
Jen: I seem to pick them, don''t I?
Jen: Sometimes I think it is my fault. If only I could be a better person, if only, if only....
Jane: You know that way of thinking will get you nowhere fast. It''s self defeating. That''s what the abusers want you think that you''re bad and you deserve every bit of abuse that they dish out.
Jen: What if he doesn''t leave? I''m afraid of asking him to leave ''cause it will only cause another fight.
Jane: You can''t spend your whole life walking on eggshells.
Jen: Yeah, you''re right... but how do I get out of this mess?
Jane: I think you''ve got to cut your losses and just move on.
Jen: Easier said than done.
Jane: I know. You''ve gotta do it Hon. If you don''t things will only get worse. Think of how much worse they''ve already got since you met him.
Jen: Yeah you''re right. Sometimes I just don''t have the strength. 
Jane: I believe in you. Please do it! Remember I''m always there for you."
107,6adfb283-8c36-4797-b689-34b49d41014f,sanjana,13727934,gpt4-32k-0613,,,,Patricia asked George to call her in an hour as she was unavailable to talk at the moment. George agreed to do so.,"Patricia: Hey, could you give me a call in an hour or so, I can''t talk now.
George: Yeah, of course.
Patricia: Thanks. "
108,36606f7e-d07f-4178-8380-8dc72dc7c0eb,sanjana,13728101,gpt4-32k-0613,,,,"Michael and Kai catch up on their recent activities. Michael has been traveling to Argentina, Brazil, and Chile for two weeks and is returning home, with plans to visit Boston soon because he found a cheap ticket. He''s considering resigning from his job in London because he''s lost motivation after three years. He''s considering moving from London, possibly back to the Netherlands to recharge, despite knowing it''s not ideal to quit without an alternative lined up. He plans to talk to his manager before making any decisions. Meanwhile, Kai is overwhelmed with work but hopes to rest after a conference in December. Michael advises Kai to rest to avoid burnout, similar to his own experience before his holiday.","Michael: hey, how are you
Kai: hey! I am fine, just working too much. what about you? you travel so much!
Michael: haha yes. At airport on my way back. looong trip
Kai: where have you been now?
Michael: argentina brazil and chile
Kai: wow! how long?
Michael: 2 weeks, lots of flights to make it work. I''m in Boston next weekend!
Kai: really??! how come?
Michael: just because I found a cheap ticket 😋
Kai: nice:) but it''s cold
Michael: hmm well.. I can deal with the cold now
Kai: are you not tired of all this travelling?
Michael: hmm, a little bit but not really. I’m more scared to stay in London and do nothing, because I’m so bored of it
Kai: I see, a man full of energy :)
Michael: well sort of, for fun stuff, but tired of work. 
Kai: yes, I remember quite well 😋
Michael: Hahah. Thinking of resigning earlier than I was planning
Kai: and then?
Michael: I don’t have an answer to that one yet, and it’s not really a solution because I’d need to work 2 months notice period anyway, but I’ve just lost motivation after 3 years
Kai: Would you like to leave London?
Michael: yes asap
Kai: for the Netherlands?
Michael: maybe to recharge and look for jobs abroad, but I don''t want to stay there. I know it’s not smart to quit without an alternative
Kai: depends on the field. I don''t know yours and your experience. But it can be a bit stressful also
Michael: true, in my field it wouldn’t be good. Anyway I need to speak to my manager and discuss because I’m not happy in my job now. How’s everything on your side? too much work?
Kai: yes, I basically never rest these days
Michael: that’s not good, you need rest to avoid a burnout, which I had just before I went on holiday
Kai: Probably, I have a conference 8th of Dec, then I''ll rest a bit, I hope."
109,8245a84d-a9fb-4bc6-8cac-7ecbb7a66e42,sanjana,13728122,gpt4-32k-0613,,,,"Daniel informs his sister Kate that he has passed his driving license exam, and she congratulates him, expressing that their father will be proud.","Daniel: Hi sis. 
Daniel: Just wanted to let you know that I passed driving license exam
Daniel: It went well :D
Kate: Congratulations!!!!
Kate: :) :) :)
Kate: Dad will be proud!"
110,f98becfb-d769-4506-aac2-d800c5a3b9f8,sanjana,13728117,gpt4-32k-0613,,,,"Sam is interested in purchasing white earphones and inquires if they are available. Lia confirms the availability and mentions that they can be delivered through courier at an additional cost. The company is located in Garstang for personal collection, which is not convenient for Sam. The earphones are new and also available in grey and pink. Sam attempts to negotiate the price, but Lia states it''s against company policy. The usual delivery period is the next day.","Sam: <file_gif>
Sam: Good afternoon, is this available?
Lia: Hi, how can I help you?
Sam: I''m interested in this product. Are the earphones available?
Lia: Yes, they are.
Sam: where can I collect them?
Lia: Well, you can have them delivered to you through courrier - this costs 4 (pay on delivery)
Lia: I''m afraid collecting them personally is a little difficult, as the product can only be collected in Garstang (where the company is located)
Sam: Okay.
Sam: Are they new? Do you have any other colors that white?
Lia: Completely new - we also offer grey and pink.
Sam: Then I would like the white ones please.
Lia: Okay, so I just need your address and telephone
Sam: The total costs 187 - can I lower the price to 180??
Lia: fraid not - company policy.
Sam: Oh, okay.
Sam: How long does it take for the product to arrive?
Lia: It generally arrives the next day, in rare instances it''s longer."
111,958dd598-5e1b-40a6-b2f5-58ebbaf96a1e,sanjana,13728157,gpt4-32k-0613,,,,"Callan is experiencing issues with his Samsung S8 device, specifically a persistent black screen which he believes is a result of overheating. This is not the first time Callan has encountered this problem. Despite warnings from Wade about the potential dangers of a faulty battery, Callan intends to take the phone to the store as it is still under warranty. He assured Wade that he won''t lose any of his files as he regularly backs up his data.","Callan: Something''s wrong with my Samsung S8.
Wade: What, exactly?
Callan: All I get is a black screen.
Wade: Did you drop it or something?
Callan: I think I know, this has happened before.
Wade:  It did? What happened before?
Callan: It overheats and then it takes a while for it to restart again..
Wade: That sucks.. Be carefull with the battery, it can be dangerous.
Callan: It sure can, but I''m going to the store and let them see it. It''s still under warranty.
Wade: Will you lose all your stuff?
Callan: No, I always back up my files."
112,8d43f0a2-4845-49e3-ac35-2221a6abd6a3,sanjana,13728300,gpt4-32k-0613,discuss their daily plans,"Jake: : What are your plans for the day?
Olivia: : I haven't really got anything planned. There are some things I should do which I haven't looked at for a while",Intrinsic_Error,"Jake and Olivia discuss their daily plans, with Olivia mentioning she needs to sort her accounts and upload videos to YouTube. They then discuss the intricacies of post-production, with Olivia noting her issues with copyright strikes when she includes music. Jake shares a story about a time when he faced a copyright challenge from Sony Music for using his own music piece.","Jake: What are your plans for the day?
Olivia: I haven''t really got anything planned. There are some things I should do which I haven''t looked at for a while
Jake: Like what?
Olivia: I ought to do my accounts. At least get all the incoming and outgoing invoices sorted by months.
Jake: Tax filing is a long way off.
Olivia: I know, but doing it all at the last minute is a dreadful headache.
Jake: Anything else?
Olivia: I also have a few videos I need to upload to YouTube.
Jake: Already ready or you still need to do post-production?
Olivia: I don''t really do much by way of post-production. I''m not exactly Steven Spielberg.
Jake: I do, but I dont always have time to do much.
Olivia: If I put in any music I always get a copyright strike and someone else is taking the ad revenue
Jake: Yeah. And some of those claims are purely speculative. One time I put on one of my own pieces and it was challenged by Sony Music
Olivia: No way!
Jake: It''s true. On the form you fill in to counter the claim I said if Sony want to make me one of their signed artists, that''s fine. Otherwise to get they paws off of my music."
113,5f5ed075-53bc-49fa-bb03-75fcf2d4552d,sanjana,13728313,gpt4-32k-0613,,,,"Kim is trying to locate fresh ramal fish in Warsaw but has had no luck so far, even after trying the marketplace at Polna street and searching online. Margot suggests that Kim should look at restaurant menus and inquire about their source, even though they might not disclose that information. Kim seems excited about the idea and reveals that she is planning to grill the fish for a special, surprise occasion. Margot expresses curiosity and excitement for Kim''s plans.","Kim: Hey, listen, have you got any idea where I can get some fresh ramal fish in Warsaw?
Margot: Hi, I don''t know about ""fresh"", but you could try the marketplace at Polna street. 
Margot: Other than that, I haven''t got a clue...
Kim: Already tried Polna :(
Margot: Ah!
Margot: Hm...
Margot: And did you check Internet for fish market in Warsaw?
Kim: Yeah, there''s none.
Kim: Or I didn''t find it. 
Margot: You could have a look at restaurants'' menus. And if you find it there, you could ask about their source. 
Margot: Although I''m not sure they''d eager to give you such infromation. But you can always try..
Kim: Great idea, I haven''t though about this! Thx!
Kim: I''ll try. After all, I have nothing to loose. 
Margot: Btw, is there a special occasion you want to cook it for?
Kim: Yes! Acctually I''ll grill it ;)
Kim: And it''s a surprise, so I''m not giving away any details!
Margot: I''m so curious!
Margot: I understant it''s sth good, so I''m happy for you girl :)
Kim: Indeed, it''s good. But you won''t get any more infromation from me now.
Kim: All in good time :)
Margot: Cruel you! Find that fish!!! ;)
Kim: :D"
