,uuid,user_id,docid,model,nonfactual_spans,evidence,error_type,summary,dialogue
114,c79a9f2e-9e06-48bc-8a11-30bfe7461217,sanjana,13728369-1,gpt4-32k-0613,,,,"Nestor is considering buying a new laptop and thinks that Black Friday is the perfect time to do so. Olaf, however, believes that Black Friday is a sales pitch and that often prices are the same or higher than usual. He suggests that Nestor compare prices before and after the promotion. Olaf also offers to help Nestor by connecting him with a person who sells nearly new computers at reasonable prices. Nestor agrees to this, with the plan to compare prices during the sale and if the deal isn''t better, consider purchasing from Olaf''s contact.","Nestor: I''m thinking of buying a new laptop
Nestor: And it seems that now is a perfect time for it as Black Friday is coming
Olaf: Hahaha
Nestor: I haven''t said anything funny, what''s wrong with you
Olaf: Everything''s fine with me, you''re just being silly
Nestor: Why, cuz I want to save some money buying what I need when it''s cheaper?
Nestor: Do you actually know what Blak Friday is about?
Olaf: Of course I know
Olaf: It''s a cunningly contrived sales pitch
Olaf: Prices are thought to be reduced but in fact they''re the same or even higher...
Nestor: You''re just repeating a stupid theory some people made up and try to convince others that it''s based on facts
Olaf: You''re really naive...
Olaf: <file_other>
Olaf: Click on this link and see for yourself
Olaf: This is one of the sites where people upload photos of the same product and its price 2 weeks before Black Friday and during the promotion
Nestor: And how do I know whether it''s a reliable source or not?
Olaf: Carry out your own investigation
Olaf: Go and check prices of the chosen products when the promotion is still on and check them again when the promotion is over
Olaf: Simple
Nestor: What if the laptop I want has been really cheaper and I''ll miss a perfect deal?
Olaf: Then I''ll help you
Olaf: I know a dude who sells almost new computers at very reasonable prices
Nestor: So ask him to send the offer of what he has in stock to me first
Nestor: If he can offer me a good deal, I''m going to the mall and starting investigation tomorrow
Nestor: Deal?
Olaf: Deal!
Olaf: I''ll call or text him and ask to contact you.
Olaf: I''m sure he''ll help you and you''ll appreciate my advice :-)
Nestor: We''ll see about that"
115,7bc5efdc-90e9-44be-a83c-c3ea0ea001f7,sanjana,13728767-1,gpt4-32k-0613,"originally assigned to their colleague, Joe","Karen: : I thought Joe was going to finish that?
Peter: : Not until 6 at the earliest, got to finish this presentation for the repairs team tomorrow
Peter: : No Eileen wanted me to do it...",Intrinsic_Error,"Karen informs Peter about a road blockage near the swimming pool due to an abundance of work vans, and suggests he should avoid it. Peter, who won''t be leaving until 6, assumes it may be due to some repairs. They also discuss a presentation Peter is working on for the repairs team, which was originally assigned to their colleague, Joe. However, due to Joe''s poor performance last time, Eileen decided to give the job to Peter. Karen offered to help, but Peter declined as he was almost finished.","Karen: you know that road from the swimming pool to Waitrose?
Peter: yeah?
Karen: What is happening there?
Peter: Dunno. What do you mean?
Karen: It''s all blocked of and vans everywhere
Peter: Is it ambulances and stuff?
Karen: Don''t think so, I didn''t see any lights or anything
Peter: what kind of vans then?
Karen: I don''t know, those big white ones, like work vans
Peter: maybe repairs to something?
Karen: yeah I guess so
Karen: either way I would avoid it if I were you, I got pretty stuck after yoga
Karen: what time are you leaving anyway?
Peter: Not until 6 at the earliest, got to finish this presentation for the repairs team tomorrow
Karen: I thought Joe was going to finish that?
Peter: No Eileen wanted me to do it...
Karen: Cause she knows you won''t say no?
Peter: Or because Joe did a pretty crappie job last time
Karen: True. let me know if you need any help.
Peter: I''m almost done, thanks though. 
Karen: see you in a bit"
116,c9421fa2-7569-4f08-b3be-c9967a9d9844,sanjana,13728835,gpt4-32k-0613,,,,"Ludo''s mum has arrived at school and confirmed that Ludo will be in room 112 with Hugo and Charles, in class 3. She wasn''t able to see the room, but described the building as big with a large garden. She has a meeting to attend and tells Ludo not to wait for her.","Ludo: hi mum, did you arrive at school?
Mum: yes , i''m in front of the door: you ''re room 112 with Hugo and Charles.
Ludo: and do you know my class number?
Mum: yes class 3, as Hugo and Charles
Ludo: good, so cool
Mum: I''ll show you the picture of the listing, but i couldn''t manage to see the room.
Ludo: Ok no problem
Mum: the building is quite big and there is also a huge garden, you''ll have room enough
Ludo: Yes i saw
Mum: i have to go, meeting is starting
Ludo: ok thanks
Mum: don''t wait for me"
117,6c3b81e0-9951-4ded-b320-93290de0d93d,sanjana,13728942,gpt4-32k-0613,,,,Dolph reminds Ziggler to bring his passport tomorrow and Ziggler acknowledges and agrees to it.,"Dolph: hey
Dolph: remember to bring your passport tomorrow
Ziggler: Cool, i will"
118,41aebf1d-e02f-4158-80d5-b0c4981366be,sanjana,13728981,gpt4-32k-0613,,,,"Calum and Bethany are discussing a job ad for a computer investigator position that pays around 80 thousand dollars. They both express skepticism about the reality of the job, considering it highly specialized and possibly difficult to find. They also joke about the possibility of ending up in less glamourous positions such as a help desk or a fast food restaurant. Both show a dislike for having to deal with difficult customers in those roles.","Calum: Oh, please. There''s an ad coming up to be a computer investigator and you can earn almost 80 thou.
Bethany: Riiiiight! Where?
Calum: Exactly. 
Bethany: I mean, that''s pretty specialized. Could be true.
Calum: Doubtful.
Bethany: At any rate, specialized so that equals hard to find a job in.
Calum: Yep. You''d be on the help desk in no time! LOL!
Bethany: Better than asking if they want fries with that!
Calum: Only slightly!
Bethany: I can''t imagine talking to stupid users all day.
Calum: Nightmare of epic proportions.
Bethany: No shit!
Calum: Putting it delicately!
Bethany: LOL!"
119,5d429991-c162-4437-a059-2d1c285e04fc,sanjana,13729057,gpt4-32k-0613,,,,Biwott asked Chloe if she has watched the series he recommended. Chloe responded that she has been too busy but plans to watch it over the weekend.,"Biwott: Did you watch the series I told you
Chloe: No not yet.
Chloe: I have been busy this week but I will watch it during the weekend
Biwott:"
120,d367c67e-413b-4b48-8c85-b972422647f5,sanjana,13729103,gpt4-32k-0613,,,,"Will is frustrated about standing in a long line at the post office just to send a letter, commenting on the irony of this situation in the 21st century. He also complains about the lack of digitalisation among the elderly who still pay their bills by cash at the post office. Chris sympathizes with him, acknowledging that lines are a part of city life and suggesting Will consider digital alternatives next time.","Will: I hate ques.
Will: I''m standing in a line longer than the post office itself.
Will: In order to just send a damn letter in XXI century.
Will: Damn
Chris: What a time to be alive :D
Chris: Lines are the part of everday life of any person living in a big city.
Chris: There is nothing special in it, but I hope you''ll think twice next time you decide to send a traditional letter.
Will: The best think about my XXI century comment is that the line consists almost entirely of elderly people who don''t have bank account and pay their bills via post office paying cash. 
Will: Where is digitalisation when you need it?
Chris: Haha. Hang on there. "
121,fd01dda6-78cd-478f-8312-83fe7835a94c,sanjana,13729106-1,gpt4-32k-0613,,,,"Jill is expressing her boredom and her need to find a job to Nate, who is currently at work. She''s also commented on having watched everything on YouTube. Nate, in a joking manner, doubts the validity of her statement and promises to call her after his work.","Jill: So bored!
Nate: Well... can''t help you there
Nate: Still at work
Jill: ugh I need to find a job
Jill: I''ve watched everything on youtube already
Nate: Doubt it :P I''ll call you when I get off work"
122,862eb3ff-e9e8-4ad2-a1d5-a0bfdd45cc38,sanjana,13729178,gpt4-32k-0613,,,,"Susan went on a date with a man who picked her up looking elegant, and instead of going to a traditional dinner at a restaurant, he took her to a roller skating disco. Susan found the date entertaining and original, while her friend Jill expressed some skepticism. Susan accuses Jill of being jealous of her date.","Jill: so how was your date anyway? :)
Susan: it was perfect, he was so sweet!! <3
Jill: tell me everything!!
Susan: so first he picked me up from home, all dressed up and everything
Jill: suit on? :D
Susan: nooo, not like that, but he had a really nice black shirt, elegant shoes, looked like Brad Pitt hahaha
Jill: hahahahaha
Susan: <file_gif>
Jill: so where did he take you?
Susan: that''s the best part! We went to rollerskating disco!!!
Jill: rollerskating what? are you serious? :/
Susan: no no, listen - it was so awesome, I am tired of all this dull restaurant dates and stuff, it was actually something original
Jill: if you say so...
Susan: you are just jealous Jill :D
Jill: I am not!!!!!!!
Susan: yes you are :*"
123,eae1df24-067c-410c-a2b7-6556b3775389,sanjana,13729197,gpt4-32k-0613,,,,Daria shared with Kelsey that she got a new job at a law firm. Kelsey was impressed with how quickly Daria secured a position given that she is a recent graduate. Kelsey congratulated Daria on her accomplishment.,"Daria: I got a new job
Kelsey: wooow where?
Daria: For a law firm! 
Kelsey: You go girl! 
Kelsey: So fast for a new graduate 
Kelsey: Well done!! 
Daria: Yeah!! 
Kelsey: Congrats!  
Daria: Thx"
124,28fe8dcd-3864-45be-84f1-ae4264cc4d54,sanjana,13729285,gpt4-32k-0613,,,,"Timmy had a bad day at work because his boss yelled at him. Gemma tried to cheer him up by inviting him to a BBQ over the weekend. She asked him to bring some wine, and mentioned that other friends will also be present at the BBQ event. Timmy jokingly thought it was a date, but Gemma reminded him that she has a boyfriend. The final guest count for the BBQ event is yet to be determined.","Gemma: How''s it going?
Timmy: A bit down 2day.
Gemma: Y?
Timmy: Oh, bad day at work. Can u imagine? Boss snapped at me!
Gemma: That bitch! What did u do?
Timmy: Nothing. Minding my own business, doing work stuff and suddenly starts shouting and screaming. Doesn''t matter. How about u?
Gemma: Well, I think this might cheer u up a bit :)
Timmy: What is it?
Gemma: I''m organising a bbq at the weekend :) wanna come?
Timmy: Love to! What do I bring?
Gemma: Some wine will be fine.
Timmy: What about food?
Gemma: Others and I will cover it.
Timmy: Others? I thought it was a date :P
Gemma: U remember I have a bf, right?
Timmy: Yeah. Just messing around ;) how many ppl?
Gemma: Don''t know yet."
125,7bbe7ee5-3427-4775-a9d2-7fa23f80b2da,sanjana,13729525,gpt4-32k-0613,,,,Rose and Jake are excited about their forthcoming payday and are planning to discuss potential Christmas gifts for their loved ones when Jake gets home. Both of them enjoy the process of selecting and giving gifts to others.,"Rose: Payday''s tomorrow :D
Rose: Can I start thinking about Christmas gifts now? 
Jake: Hahaha. Sure. When I get home, we''ll talk about what should we buy for everybody.
Rose: I can''t wait.
Rose: I love making gifts for people!
Jake: Yup. Me too."
126,ec5c17c0-f27a-4bb3-9dde-373e308a12d0,sanjana,13729697,gpt4-32k-0613,,,,"Murphy is planning to go to Poanań on Tuesday and return the same day in the afternoon, though he is unsure of the exact time.","Sophie: When r u going to Poanań?
Murphy: On Tuesday. 
Sophie: And you''re coming back the same day?
Murphy: Yes, in the afternoon, but I don''t know the exact hour. "
127,ed46dffd-e0eb-4464-9fbb-42f17ef0bbe0,sanjana,13730403,gpt4-32k-0613,,,,"Tom suggests to Camilla that they should visit Dublin, Ireland for the weekend. Camilla is excited about the plan, and Tom proceeds to buy the tickets.","Tom: Have you ever been to Dublin?
Camilla: Never in Ireland!
Tom: So let''s go there this weekend!
Camilla: for 2 days?
Tom: Yes, the weather forecast is great!
Camilla: I love your crazy ideas!
Tom: ok, so I''m buying the tickets
Camilla: <3"
128,19e692ea-1fc3-43f6-8f67-902b9f9d2b30,sanjana,13730432,gpt4-32k-0613,,,,Charlie invites Frank to celebrate his sister''s completion of her last exam at the university. Frank agrees and asks Charlie to update him when the plans are clearer.,"Charlie: My sister has just passed her last exam on her Uni
Charlie: Got something to celebrate
Charlie: Wanna go out with us tonight?
Frank: Sure why not.
Frank: Let me know later when the plan clarifies.
Charlie: Kk."
129,83650849-d987-4a08-88da-722bdaf6dd6f,sanjana,13730529,gpt4-32k-0613,,,,"Mark told his sister that Mary is working an online job, hoping to make his sister jealous. However, this backfired as his sister started contacting people Mary works with, prompting Mary to ask Mark to be more careful in the future. Despite the misunderstanding, they ended their conversation with expressions of love for each other.","Mary: Did you tell your sister I am doing online job?
Mark: yes !
Mary: why
Mark: because she keep saying your good for nothing?
Mary: dint I tell you I dont care?
Mark: what happened?
Mary: see I dont want to prove anything to anyone..
Mark: I know but I was just feeling proud so it was kind of show off
Mary: she is asking everyone and trying to get to the people I am working for
Mark: really!! I am sorry for that
Mary: dont be! I understand your feelings  but u know how she is
Mark: I know!! :? 
Mary: dont be sad now its ok.. she cant do much about it chill its ok but just be careful
Mark: I will be ..
Mary: btw it feels good that she is so jealous :P
Mark: lol my aim was to make her feel jealous
Mary: but i dont like it that she tries to contact the people i am working for ... what does she want?
Mark: may be she wants to confirm if its true... because its not easy to digest that your working from home and earning well!!!
Mary: whatever i just hate her
Mark: chill now .... :) love you
Mary: i am chilled :cool: ... love you too honey"
130,30bb8ba5-9539-4e3a-b173-4febd2acbe5f,sanjana,13730560,gpt4-32k-0613,,,,Oscar and Payne plan to meet at Tristano''s for coffee in half an hour.,"Oscar: A coffee at Tristano''s?
Payne: Why not. in 15 mins?
Oscar: let''s make it half an hour ok?
Payne: great, i''ll be there
Oscar: see you there"
131,5ec388dc-4615-4a08-a96d-30f88f48b670,sanjana,13730597,gpt4-32k-0613,,,,"Amelia asks Emily about her favorite color, which Emily reveals to be blue. Amelia appears to be holding a secret related to Emily''s favorite color but refuses to reveal it, which piques Emily''s curiosity.","Amelia: What is your favourite colour?
Emily: Blue, why?
Amelia: I can''t tell you
Emily: A surprise? =)
Amelia: Sort of... Can''t tell you anything more
Amelia: Sorry 
Emily: I''m super curious"
132,205b941c-d24a-442d-be88-4dd5f1f2f169,sanjana,13730730,gpt4-32k-0613,she's open to a phone call,"Christine: : Yeah. Don't call in because I'll feel bad if you catch this cold off me.
Annie: : I think I probably had it already, but you might be sleeping.
Christine: : If the light in my room is on, call if you want.",Intrinsic_Error,"Christine won''t be attending school because she thinks she has the flu, but doesn''t have a high temperature. Her symptoms include a blocked nose and a sore throat, and she is feeling tired. She is eating fine and would appreciate some Theraflu. Annie offers to drop some off, but Christine warns her not to come in case she catches the cold. If she''s awake, evidenced by her room light being on, she''s open to a phone call.","Annie: Are you going to be at school?
Christine: Not tomorrow. I am not well.
Annie: Oh noes! What happened?
Christine: Got the flu, I think.
Annie: what''s your temperature?
Christine: Not high, I''m not running a fever or anything
Annie: Are you eating ok?
Christine: Yeah. Just blocked nose, sore throat. Tired.
Annie: Sounds like you''ve got a cold. You need anything?
Christine: I could do with some Theraflu.
Annie: OK, I think we''ve still got some sachets, should be in date. I''ll drop them through your letterbox later on.
Christine: Yeah. Don''t call in because I''ll feel bad if you catch this cold off me.
Annie: I think I probably had it already, but you might be sleeping.
Christine: If the light in my room is on, call if you want."
133,abeb16d5-7fae-40ba-b14e-a7a5644dae73,sanjana,13730863,gpt4-32k-0613,,,,"Taylor invites Harry to a party at her house tomorrow at 8 PM while her parents are away. She informs him that 10 people are already confirmed to attend, and Harry responds positively, excited to join. Taylor insists it''s going to be the party of the year.","Taylor: Tomorrow, 8 PM, my house
Harry: Lol, whats up?
Taylor: My parents are away, 10 people confirmed already :D
Harry: Im sooo in
Taylor: You better, youd miss the party of the year!"
134,49228d97-ba5c-4099-98f0-ebe85fec1a8c,sanjana,13730868,gpt4-32k-0613,,,,"Tom and Ben have agreed to meet in the Oval Room at 2pm for an intense discussion or negotiation, which Tom implies will be a difficult battle. But they are confident in their victory, believing that justice is on their side.","Tom: Ben. We''ve decided. 2pm in the Oval Room.
Ben: Ok, I''ll be there
Tom: Take all your papers, it''s going to be a fight! And remember: take no prisoners, shoot to kill!
Ben: hahaha, we have to win this battle.
Tom: We will, the justice is on our side."
135,951397b4-69e7-410e-be85-2384d32f5d9f,sanjana,13729306,gpt4-32k-0613,,,,"Jules shares a meme with Derek, who admits he doesn''t understand it. Jules then asks Derek if they have class tomorrow, to which Derek confirms that they do since it is Friday. Jules expresses confusion about this, having apparently been misinformed. Derek reacts sympathetically.","Jules: What does it mean?
Jules: <file_gif>
Derek: Sorry, I was never good at memes
Jules: what a shame...
Jules: by the way, do we have class tomorrow?
Derek: surely, it''s friday after all
Jules: oops, someone misled me
Derek: that''s not nice"
136,81e90316-e9d7-439f-a0e0-ae8972354730,sanjana,13729565,gpt4-32k-0613,character referred to as MACHINE,Not found,Extrinsic_Error,"Eric and Rob are discussing a stand-up comedy routine they both enjoyed, particularly a segment involving a train and a character referred to as MACHINE. They find humor in the exaggerated portrayal of a Russian character and decide to look up more of the comedian''s work on Youtube. They affirm their enjoyment by repeating the phrase ""MACHINE!"" before signing off.","Eric: MACHINE!
Rob: That''s so gr8!
Eric: I know! And shows how Americans see Russian ;)
Rob: And it''s really funny!
Eric: I know! I especially like the train part!
Rob: Hahaha! No one talks to the machine like that!
Eric: Is this his only stand-up?
Rob: Idk. I''ll check.
Eric: Sure.
Rob: Turns out no! There are some of his stand-ups on youtube.
Eric: Gr8! I''ll watch them now!
Rob: Me too!
Eric: MACHINE!
Rob: MACHINE!
Eric: TTYL?
Rob: Sure :)"
137,dd281c23-f453-4495-908d-af9f68e23c5d,sanjana,13729618,gpt4-32k-0613,,,,"Freddie asks his grandmother, Winnie, if she''s planning on visiting, to which she responds that she can''t due to a broken leg. She suggests Freddie and his parents visit her instead. Freddie expresses his concern for his grandmother and hopes for her quick recovery. Winnie requests Freddie to ask his mother to call her.","Freddie: Nanna, are you coming to visit us soon?
Winnie: Oh darling, Nanna has broken her leg, you''ll have to visit me instead.
Freddie: I forgott. Well come soon.
Winnie: Good, ask Mummy and Daddy and they will come when they can.
Freddie: Yes love you. Leg better soon?
Winnie: Yes, quite soon. Tell mummy to ring me. Bye darling xxxxx"
138,e58c60b4-a597-4d82-b9f9-6fdbb0c72259,sanjana,13729704,gpt4-32k-0613,"humorously repeating his uncle's playful misspelling of ""graduated""","Uncle : Jayson: My nephew gradumacated! 
Ewan: : Haha thanks! Gradiated! ",Intrinsic_Error,"Ewan informs his Uncle Jayson that he has graduated. His uncle congratulates him and remarks on how quickly time passes. Ewan thanks his uncle for his congratulations, humorously repeating his uncle''s playful misspelling of ""graduated"".","Ewan: Uncle I graduated!
Uncle Jayson: My nephew gradumacated! 
Uncle Jayson: How time flies congrats!
Ewan: Haha thanks! Gradiated! 
Uncle Jayson:"
139,65a61db6-e4f0-4c27-8ff5-a42ebfd793d1,sanjana,13730094,gpt4-32k-0613,,,,"Pam lost her iPhone while out shopping and was unable to locate it when she returned to the stores she had visited. Her friend Dot suggests using the Apple account to remotely display a message on the screen, possibly offering a reward for the return of the phone. Pam appreciates the advice and intends to follow it.","Pam: Hey I lost my phone so if you need something message me here
Dot: Oh now how??
Pam: I went shopping and when I was paying I must have left my phone on the counter
Dot: Did you come back to check if they found it?
Pam: I talked to every single store I visited and nothing :(
Dot: It was an iphone right?
Pam: Yeah, I''ve only had it for half a year
Dot: But there''s an option where you can display something on the screen
Pam: How?
Dot: You have to log into your apple account and there is an instruction
Pam: Cool!! I have to check it out
Dot: You could promise a reward and post someone''s phone number
Pam: I''ll do that!! Thanks!!
Dot: I hope you find it :*"
140,cceaab96-7ef5-43c1-abb2-0f81b953a6a0,sanjana,13730105,gpt4-32k-0613,,,,"Anna is explaining to Peter the value of an app that allows users to add the clothes they own and then gives advice on what to wear. Initially, Peter doesn''t see the need for the app, as he is used to selecting his clothes without any help. But Anna demonstrates how the app could save time and stress for someone with a larger wardrobe, making Peter begin to understand its potential usefulness.","Anna: Still, great app! And it''s for men too! U choose ur sex and then add photos of clothes :)
Peter: Is there a minimum number of clothes I should add?
Anna: No! And there is no maximum! You can add as many as u want!
Peter: So if I only add 3 items, I will always get the same results?
Anna: Ur still making fun of me!
Peter: I just don''t get it. Every morning I approach my wardrobe, open it, choose the clothes I want to wear or prepare them the previous day and that''s it. I don''t need an app to tell me what to wear with what.
Anna: Okay... Let''s play a game. 
Peter: You''re not going to make me cut my fingers off?
Anna: No ;) how many pairs of trousers do u have?
Peter: 5 or 6.
Anna: How many shirts do you have?
Peter: T-shirts or regular shirts?
Anna: Shirts. Let''s focus on ur work look.
Peter: 3 or 4.
Anna: What about jackets?
Peter: 2.
Anna: Great! Now imagine I have 12 shirts, 10 pairs of trousers, and 6 jackets. And I have to decide what to wear in a split second.
Peter: All right. It''s slowly dawning on me."
141,3883863b-f15f-42c9-a2c0-8554c3b41cd5,sanjana,13730145,gpt4-32k-0613,,,,"Michelle expresses her fondness for her friend Kelly, which Jared echoes and reveals that he wants to ask Kelly out. Despite their past relationship, Michelle gives Jared her blessing to pursue a relationship with Kelly.","Michelle: i love kelly, she''s so sweet
Jared: i like her too, i like her a lot
Jared: do you mind if i ask her out?
Michelle: of course not! why would i?
Jared: well... you and i used to go out, and she''s your bestfriend
Michelle: nonsense, you should ask her out! :-D"
142,c0c4e75e-a8ad-482e-994b-35903d8aa0ac,sanjana,13730167,gpt4-32k-0613,,,,"Erin and Ashley planned to meet for an interview at the camp where Ashley is currently located. They decided to have the meeting at the restaurant area because the wifi connection is more stable there. Ashley is already there and waiting for Erin, who is on her way.
","Erin: hey what''s up. what you''re doing today? Would you find some time to do the interview? :)
Ashley: Hi! I’m free whenever
Erin: Great, are you at the camp?
Ashley: Yep, I’m here now.
Erin: Ok I can come over there
Ashley: Sounds good. Just shoot me a message and we can meet at the pool or restaurant
Erin: Alright!
Erin: Is the wifi good today?
Ashley: Yeah pretty decent, but usually it''s less spotty in the restaurant area
Erin: Ok I see, so the restaurant it is
Ashley: Alright
Erin: I''m on my way!
Ashley: I''m sitting in the back"
